id,abstract
5536,"  In a standard bifurcation of a dynamical system, the stationary points (or
more generally attractors) change qualitatively when varying a control
parameter. Here we describe a novel unusual effect, when the change of a
parameter, e.g. a growth rate, does not influence the stationary states, but
nevertheless leads to a qualitative change of dynamics. For instance, such a
dynamic transition can be between the convergence to a stationary state and a
strong increase without stationary states, or between the convergence to one
stationary state and that to a different state. This effect is illustrated for
a dynamical system describing two symbiotic populations, one of which exhibits
a growth rate larger than the other one. We show that, although the stationary
states of the dynamical system do not depend on the growth rates, the latter
influence the boundary of the basins of attraction. This change of the basins
of attraction explains this unusual effect of the quantitative change of
dynamics by growth rate variation.
"
8045,"  Generative adversarial networks (GANs) transform latent vectors into visually
plausible images. It is generally thought that the original GAN formulation
gives no out-of-the-box method to reverse the mapping, projecting images back
into latent space. We introduce a simple, gradient-based technique called
stochastic clipping. In experiments, for images generated by the GAN, we
precisely recover their latent vector pre-images 100% of the time. Additional
experiments demonstrate that this method is robust to noise. Finally, we show
that even for unseen images, our method appears to recover unique encodings.
"
4841,"  Modern neural networks tend to be overconfident on unseen, noisy or
incorrectly labelled data and do not produce meaningful uncertainty measures.
Bayesian deep learning aims to address this shortcoming with variational
approximations (such as Bayes by Backprop or Multiplicative Normalising Flows).
However, current approaches have limitations regarding flexibility and
scalability. We introduce Bayes by Hypernet (BbH), a new method of variational
approximation that interprets hypernetworks as implicit distributions. It
naturally uses neural networks to model arbitrarily complex distributions and
scales to modern deep learning architectures. In our experiments, we
demonstrate that our method achieves competitive accuracies and predictive
uncertainties on MNIST and a CIFAR5 task, while being the most robust against
adversarial attacks.
"
16848,"  Data warehouse performance is usually achieved through physical data
structures such as indexes or materialized views. In this context, cost models
can help select a relevant set ofsuch performance optimization structures.
Nevertheless, selection becomes more complex in the cloud. The criterion to
optimize is indeed at least two-dimensional, with monetary cost balancing
overall query response time. This paper introduces new cost models that fit
into the pay-as-you-go paradigm of cloud computing. Based on these cost models,
an optimization problem is defined to discover, among candidate views, those to
be materialized to minimize both the overall cost of using and maintaining the
database in a public cloud and the total response time ofa given query
workload. We experimentally show that maintaining materialized views is always
advantageous, both in terms of performance and cost.
"
10618,"  One of the essential prerequisites for detection of Earth-like extra-solar
planets or direct measurements of the cosmological expansion is the accurate
and precise wavelength calibration of astronomical spectrometers. It has
already been realized that the large number of exactly known optical
frequencies provided by laser frequency combs ('astrocombs') can significantly
surpass conventionally used hollow-cathode lamps as calibration light sources.
A remaining challenge, however, is generation of frequency combs with lines
resolvable by astronomical spectrometers. Here we demonstrate an astrocomb
generated via soliton formation in an on-chip microphotonic resonator
('microresonator') with a resolvable line spacing of 23.7 GHz. This comb is
providing wavelength calibration on the 10 cm/s radial velocity level on the
GIANO-B high-resolution near-infrared spectrometer. As such, microresonator
frequency combs have the potential of providing broadband wavelength
calibration for the next-generation of astronomical instruments in
planet-hunting and cosmological research.
"
14100,"  We make the case for studying the complexity of approximately simulating
(sampling) quantum systems for reasons beyond that of quantum computational
supremacy, such as diagnosing phase transitions. We consider the sampling
complexity as a function of time $t$ due to evolution generated by spatially
local quadratic bosonic Hamiltonians. We obtain an upper bound on the scaling
of $t$ with the number of bosons $n$ for which approximate sampling is
classically efficient. We also obtain a lower bound on the scaling of $t$ with
$n$ for which any instance of the boson sampling problem reduces to this
problem and hence implies that the problem is hard, assuming the conjectures of
Aaronson and Arkhipov [Proc. 43rd Annu. ACM Symp. Theory Comput. STOC '11].
This establishes a dynamical phase transition in sampling complexity. Further,
we show that systems in the Anderson-localized phase are always easy to sample
from at arbitrarily long times. We view these results in the light of
classifying phases of physical systems based on parameters in the Hamiltonian.
In doing so, we combine ideas from mathematical physics and computational
complexity to gain insight into the behavior of condensed matter, atomic,
molecular and optical systems.
"
358,"  A new Short-Orbit Spectrometer (SOS) has been constructed and installed
within the experimental facility of the A1 collaboration at Mainz Microtron
(MAMI), with the goal to detect low-energy pions. It is equipped with a
Browne-Buechner magnet and a detector system consisting of two helium-ethane
based drift chambers and a scintillator telescope made of five layers. The
detector system allows detection of pions in the momentum range of 50 - 147
MeV/c, which corresponds to 8.7 - 63 MeV kinetic energy. The spectrometer can
be placed at a distance range of 54 - 66 cm from the target center. Two
collimators are available for the measurements, one having 1.8 msr aperture and
the other having 7 msr aperture. The Short-Orbit Spectrometer has been
successfully calibrated and used in coincidence measurements together with the
standard magnetic spectrometers of the A1 collaboration.
"
16185,"  Many organisms repartition their proteome in a circadian fashion in response
to the daily nutrient changes in their environment. A striking example is
provided by cyanobacteria, which perform photosynthesis during the day to fix
carbon. These organisms not only face the challenge of rewiring their proteome
every 12 hours, but also the necessity of storing the fixed carbon in the form
of glycogen to fuel processes during the night. In this manuscript, we extend
the framework developed by Hwa and coworkers (Scott et al., Science 330, 1099
(2010)) for quantifying the relatinship between growth and proteome composition
to circadian metabolism. We then apply this framework to investigate the
circadian metabolism of the cyanobacterium Cyanothece, which not only fixes
carbon during the day, but also nitrogen during the night, storing it in the
polymer cyanophycin. Our analysis reveals that the need to store carbon and
nitrogen tends to generate an extreme growth strategy, in which the cells
predominantly grow during the day, as observed experimentally. This strategy
maximizes the growth rate over 24 hours, and can be quantitatively understood
by the bacterial growth laws. Our analysis also shows that the slow relaxation
of the proteome, arising from the slow growth rate, puts a severe constraint on
implementing this optimal strategy. Yet, the capacity to estimate the time of
the day, enabled by the circadian clock, makes it possible to anticipate the
daily changes in the environment and mount a response ahead of time. This
significantly enhances the growth rate by counteracting the detrimental effects
of the slow proteome relaxation.
"
20202,"  We study the critical behavior of a general contagion model where nodes are
either active (e.g. with opinion A, or functioning) or inactive (e.g. with
opinion B, or damaged). The transitions between these two states are determined
by (i) spontaneous transitions independent of the neighborhood, (ii)
transitions induced by neighboring nodes and (iii) spontaneous reverse
transitions. The resulting dynamics is extremely rich including limit cycles
and random phase switching. We derive a unifying mean-field theory.
Specifically, we analytically show that the critical behavior of systems whose
dynamics is governed by processes (i-iii) can only exhibit three distinct
regimes: (a) uncorrelated spontaneous transition dynamics (b) contact process
dynamics and (c) cusp catastrophes. This ends a long-standing debate on the
universality classes of complex contagion dynamics in mean-field and
substantially deepens its mathematical understanding.
"
20290,"  Many approaches for testing configurable software systems start from the same
assumption: it is impossible to test all configurations. This motivated the
definition of variability-aware abstractions and sampling techniques to cope
with large configuration spaces. Yet, there is no theoretical barrier that
prevents the exhaustive testing of all configurations by simply enumerating
them, if the effort required to do so remains acceptable. Not only this: we
believe there is lots to be learned by systematically and exhaustively testing
a configurable system. In this case study, we report on the first ever
endeavour to test all possible configurations of an industry-strength, open
source configurable software system, JHipster, a popular code generator for web
applications. We built a testing scaffold for the 26,000+ configurations of
JHipster using a cluster of 80 machines during 4 nights for a total of 4,376
hours (182 days) CPU time. We find that 35.70% configurations fail and we
identify the feature interactions that cause the errors. We show that sampling
strategies (like dissimilarity and 2-wise): (1) are more effective to find
faults than the 12 default configurations used in the JHipster continuous
integration; (2) can be too costly and exceed the available testing budget. We
cross this quantitative analysis with the qualitative assessment of JHipster's
lead developers.
"
3351,"  Complex computer simulators are increasingly used across fields of science as
generative models tying parameters of an underlying theory to experimental
observations. Inference in this setup is often difficult, as simulators rarely
admit a tractable density or likelihood function. We introduce Adversarial
Variational Optimization (AVO), a likelihood-free inference algorithm for
fitting a non-differentiable generative model incorporating ideas from
generative adversarial networks, variational optimization and empirical Bayes.
We adapt the training procedure of generative adversarial networks by replacing
the differentiable generative network with a domain-specific simulator. We
solve the resulting non-differentiable minimax problem by minimizing
variational upper bounds of the two adversarial objectives. Effectively, the
procedure results in learning a proposal distribution over simulator
parameters, such that the JS divergence between the marginal distribution of
the synthetic data and the empirical distribution of observed data is
minimized. We evaluate and compare the method with simulators producing both
discrete and continuous data.
"
6120,"  We study the dispersion of a point set, a notion closely related to the
discrepancy. Given a real $r\in (0,1)$ and an integer $d\geq 2$, let $N(r,d)$
denote the minimum number of points inside the $d$-dimensional unit cube
$[0,1]^d$ such that they intersect every axis-aligned box inside $[0,1]^d$ of
volume greater than $r$. We prove an upper bound on $N(r,d)$, matching a lower
bound of Aistleitner et al. up to a multiplicative constant depending only on
$r$. This fully determines the rate of growth of $N(r,d)$ if $r\in(0,1)$ is
fixed.
"
16047,"  We present a multi-wavelength compilation of new and previously-published
photometry for 55 Galactic field RR Lyrae variables. Individual studies,
spanning a time baseline of up to 30 years, are self-consistently phased to
produce light curves in 10 photometric bands covering the wavelength range from
0.4 to 4.5 microns. Data smoothing via the GLOESS technique is described and
applied to generate high-fidelity light curves, from which mean magnitudes,
amplitudes, rise-times, and times of minimum and maximum light are derived.
60,000 observations were acquired using the new robotic Three-hundred
MilliMeter Telescope (TMMT), which was first deployed at the Carnegie
Observatories in Pasadena, CA, and is now permanently installed and operating
at Las Campanas Observatory in Chile. We provide a full description of the TMMT
hardware, software, and data reduction pipeline. Archival photometry
contributed approximately 31,000 observations. Photometric data are given in
the standard Johnson UBV, Kron-Cousins RI, 2MASS JHK, and Spitzer [3.6] & [4.5]
bandpasses.
"
20600,"  In this paper, we propose a quality enhancement network for Versatile Video
Coding (VVC) compressed videos by jointly exploiting spatial details and
temporal structure (SDTS). The network consists of a temporal structure
prediction subnet and a spatial detail enhancement subnet. The former subnet is
used to estimate and compensate the temporal motion across frames, and the
spatial detail subnet is used to reduce the compression artifacts and enhance
the reconstruction quality of the VVC compressed video. Experimental results
demonstrate the effectiveness of our SDTS-based approach. It offers over
7.82$\%$ BD-rate saving on the common test video sequences and achieves the
state-of-the-art performance.
"
9584,"  We study the notion of consistency between a 3D shape and a 2D observation
and propose a differentiable formulation which allows computing gradients of
the 3D shape given an observation from an arbitrary view. We do so by
reformulating view consistency using a differentiable ray consistency (DRC)
term. We show that this formulation can be incorporated in a learning framework
to leverage different types of multi-view observations e.g. foreground masks,
depth, color images, semantics etc. as supervision for learning single-view 3D
prediction. We present empirical analysis of our technique in a controlled
setting. We also show that this approach allows us to improve over existing
techniques for single-view reconstruction of objects from the PASCAL VOC
dataset.
"
13703,"  We use the ab initio Bethe Ansatz dynamics to predict the dissociation of
one-dimensional cold-atom breathers that are created by a quench from a
fundamental soliton. We find that the dissociation is a robust quantum
many-body effect, while in the mean-field (MF) limit the dissociation is
forbidden by the integrability of the underlying nonlinear Schrödinger
equation. The analysis demonstrates the possibility to observe quantum
many-body effects without leaving the MF range of experimental parameters. We
find that the dissociation time is of the order of a few seconds for a typical
atomic-soliton setting.
"
9655,"  A map $f\colon K\to \mathbb R^d$ of a simplicial complex is an almost
embedding if $f(\sigma)\cap f(\tau)=\emptyset$ whenever $\sigma,\tau$ are
disjoint simplices of $K$.
Theorem. Fix integers $d,k\ge2$ such that $d=\frac{3k}2+1$.
(a) Assume that $P\ne NP$. Then there exists a finite $k$-dimensional complex
$K$ that does not admit an almost embedding in $\mathbb R^d$ but for which
there exists an equivariant map $\tilde K\to S^{d-1}$.
(b) The algorithmic problem of recognition almost embeddability of finite
$k$-dimensional complexes in $\mathbb R^d$ is NP hard.
The proof is based on the technique from the Matoušek-Tancer-Wagner paper
(proving an analogous result for embeddings), and on singular versions of the
higher-dimensional Borromean rings lemma and a generalized van Kampen--Flores
theorem.
"
10977,"  We develop a linear algebraic framework for the shape-from-shading problem,
because tensors arise when scalar (e.g. image) and vector (e.g. surface normal)
fields are differentiated multiple times. The work is in two parts. In this
first part we investigate when image derivatives exhibit invariance to changing
illumination by calculating the statistics of image derivatives under general
distributions on the light source. We computationally validate the hypothesis
that image orientations (derivatives) provide increased invariance to
illumination by showing (for a Lambertian model) that a shape-from-shading
algorithm matching gradients instead of intensities provides more accurate
reconstructions when illumination is incorrectly estimated under a flatness
prior.
"
9973,"  Exploratory testing is neither black nor white, but rather a continuum of
exploration exists. In this research we propose an approach for decision
support helping practitioners to distribute time between different degrees of
exploratory testing on that continuum. To make the continuum manageable, five
levels have been defined: freestyle testing, high, medium and low degrees of
exploration, and scripted testing. The decision support approach is based on
the repertory grid technique. The approach has been used in one company. The
method for data collection was focus groups. The results showed that the
proposed approach aids practitioners in the reflection of what exploratory
testing levels to use, and aligns their understanding for priorities of
decision criteria and the performance of exploratory testing levels in their
contexts. The findings also showed that the participating company, which is
currently conducting mostly scripted testing, should spend more time on testing
using higher degrees of exploration in comparison to scripted testing.
"
3860,"  In this paper we describe two fully mass conservative, energy stable, finite
difference methods on a staggered grid for the quasi-incompressible
Navier-Stokes-Cahn-Hilliard (q-NSCH) system governing a binary incompressible
fluid flow with variable density and viscosity. Both methods, namely the
primitive method (finite difference method in the primitive variable
formulation) and the projection method (finite difference method in a
projection-type formulation), are so designed that the mass of the binary fluid
is preserved, and the energy of the system equations is always non-increasing
in time at the fully discrete level. We also present an efficient, practical
nonlinear multigrid method - comprised of a standard FAS method for the
Cahn-Hilliard equation, and a method based on the Vanka-type smoothing strategy
for the Navier-Stokes equation - for solving these equations. We test the
scheme in the context of Capillary Waves, rising droplets and Rayleigh-Taylor
instability. Quantitative comparisons are made with existing analytical
solutions or previous numerical results that validate the accuracy of our
numerical schemes. Moreover, in all cases, mass of the single component and the
binary fluid was conserved up to 10 to -8 and energy decreases in time.
"
2151,"  Motivated by applications that arise in online social media and collaboration
networks, there has been a lot of work on community-search and team-formation
problems. In the former class of problems, the goal is to find a subgraph that
satisfies a certain connectivity requirement and contains a given collection of
seed nodes. In the latter class of problems, on the other hand, the goal is to
find individuals who collectively have the skills required for a task and form
a connected subgraph with certain properties.
In this paper, we extend both the community-search and the team-formation
problems by associating each individual with a profile. The profile is a
numeric score that quantifies the position of an individual with respect to a
topic. We adopt a model where each individual starts with a latent profile and
arrives to a conformed profile through a dynamic conformation process, which
takes into account the individual's social interaction and the tendency to
conform with one's social environment. In this framework, social tension arises
from the differences between the conformed profiles of neighboring individuals
as well as from differences between individuals' conformed and latent profiles.
Given a network of individuals, their latent profiles and this conformation
process, we extend the community-search and the team-formation problems by
requiring the output subgraphs to have low social tension. From the technical
point of view, we study the complexity of these problems and propose algorithms
for solving them effectively. Our experimental evaluation in a number of social
networks reveals the efficacy and efficiency of our methods.
"
380,"  The 1+1 REMPI spectrum of SiO in the 210-220 nm range is recorded. Observed
bands are assigned to the $A-X$ vibrational bands $(v``=0-3, v`=5-10)$ and a
tentative assignment is given to the 2-photon transition from $X$ to the
n=12-13 $[X^{2}{\Sigma}^{+},v^{+}=1]$ Rydberg states at 216-217 nm. We estimate
the IP of SiO to be 11.59(1) eV. The SiO$^{+}$ cation has previously been
identified as a molecular candidate amenable to laser control. Our work allows
us to identify an efficient method for loading cold SiO$^{+}$ from an ablated
sample of SiO into an ion trap via the $(5,0)$ $A-X$ band at 213.977 nm.
"
20512,"  Wireless engineers and business planners commonly raise the question on
where, when, and how millimeter-wave (mmWave) will be used in 5G and beyond.
Since the next generation network is not just a new radio access standard, but
instead an integration of networks for vertical markets with diverse
applications, answers to the question depend on scenarios and use cases to be
deployed. This paper gives four 5G mmWave deployment examples and describes in
chronological order the scenarios and use cases of their probable deployment,
including expected system architectures and hardware prototypes. The paper
starts with 28 GHz outdoor backhauling for fixed wireless access and moving
hotspots, which will be demonstrated at the PyeongChang winter Olympic games in
2018. The second deployment example is a 60 GHz unlicensed indoor access system
at the Tokyo-Narita airport, which is combined with Mobile Edge Computing (MEC)
to enable ultra-high speed content download with low latency. The third example
is mmWave mesh network to be used as a micro Radio Access Network ({\mu}-RAN),
for cost-effective backhauling of small-cell Base Stations (BSs) in dense urban
scenarios. The last example is mmWave based Vehicular-to-Vehicular (V2V) and
Vehicular-to-Everything (V2X) communications system, which enables automated
driving by exchanging High Definition (HD) dynamic map information between cars
and Roadside Units (RSUs). For 5G and beyond, mmWave and MEC will play
important roles for a diverse set of applications that require both ultra-high
data rate and low latency communications.
"
17806,"  Existing urban boundaries are usually defined by government agencies for
administrative, economic, and political purposes. Defining urban boundaries
that consider socio-economic relationships and citizen commute patterns is
important for many aspects of urban and regional planning. In this paper, we
describe a method to delineate urban boundaries based upon human interactions
with physical space inferred from social media. Specifically, we depicted the
urban boundaries of Great Britain using a mobility network of Twitter user
spatial interactions, which was inferred from over 69 million geo-located
tweets. We define the non-administrative anthropographic boundaries in a
hierarchical fashion based on different physical movement ranges of users
derived from the collective mobility patterns of Twitter users in Great
Britain. The results of strongly connected urban regions in the form of
communities in the network space yield geographically cohesive, non-overlapping
urban areas, which provide a clear delineation of the non-administrative
anthropographic urban boundaries of Great Britain. The method was applied to
both national (Great Britain) and municipal scales (the London metropolis).
While our results corresponded well with the administrative boundaries, many
unexpected and interesting boundaries were identified. Importantly, as the
depicted urban boundaries exhibited a strong instance of spatial proximity, we
employed a gravity model to understand the distance decay effects in shaping
the delineated urban boundaries. The model explains how geographical distances
found in the mobility patterns affect the interaction intensity among different
non-administrative anthropographic urban areas, which provides new insights
into human spatial interactions with urban space.
"
