id,abstract
13565,"  The area of Handwritten Signature Verification has been broadly researched in
the last decades, but remains an open research problem. In offline (static)
signature verification, the dynamic information of the signature writing
process is lost, and it is difficult to design good feature extractors that can
distinguish genuine signatures and skilled forgeries. This verification task is
even harder in writer independent scenarios which is undeniably fiscal for
realistic cases. In this paper, we have proposed an Ensemble model for offline
writer, independent signature verification task with Deep learning. We have
used two CNNs for feature extraction, after that RGBT for classification &
Stacking to generate final prediction vector. We have done extensive
experiments on various datasets from various sources to maintain a variance in
the dataset. We have achieved the state of the art performance on various
datasets.
"
18043,"  We investigate the constraints on the sum of neutrino masses ($\Sigma m_\nu$)
using the most recent cosmological data, which combines the distance
measurement from baryonic acoustic oscillation in the extended Baryon
Oscillation Spectroscopic Survey DR14 quasar sample with the power spectra of
temperature and polarization anisotropies in the cosmic microwave background
from the Planck 2015 data release. We also use other low-redshift observations
including the baryonic acoustic oscillation at relatively low redshifts, the
supernovae of type Ia and the local measurement of Hubble constant. In the
standard cosmological constant $\Lambda$ cold dark matter plus massive neutrino
model, we obtain the $95\%$ \acl{CL} upper limit to be $\Sigma
m_\nu<0.129~\mathrm{eV}$ for the degenerate mass hierarchy, $\Sigma
m_{\nu}<0.159~\mathrm{eV}$ for the normal mass hierarchy, and $\Sigma
m_{\nu}<0.189~\mathrm{eV}$ for the inverted mass hierarchy. Based on Bayesian
evidence, we find that the degenerate hierarchy is positively supported, and
the current data combination can not distinguish normal and inverted
hierarchies. Assuming the degenerate mass hierarchy, we extend our study to
non-standard cosmological models including the generic dark energy, the spatial
curvature, and the extra relativistic degrees of freedom, respectively, but
find these models not favored by the data.
"
19571,"  Complex Finsler vector bundles have been studied mainly by T. Aikou, who
defined complex Finsler structures on holomorphic vector bundles. In this
paper, we consider the more general case of a holomorphic Lie algebroid E and
we introduce Finsler structures, partial and Chern-Finsler connections on it.
First, we recall some basic notions on holomorphic Lie algebroids. Then, using
an idea from E. Martinez, we introduce the concept of complexified prolongation
of such an algebroid. Also, we study nonlinear and linear connections on the
tangent bundle of E and on the prolongation of E and we investigate the
relation between their coefficients. The analogue of the classical
Chern-Finsler connection is defined and studied in the paper for the case of
the holomorphic Lie algebroid.
"
9848,"  Automatic differentiation (AD) is an essential primitive for machine learning
programming systems. Tangent is a new library that performs AD using source
code transformation (SCT) in Python. It takes numeric functions written in a
syntactic subset of Python and NumPy as input, and generates new Python
functions which calculate a derivative. This approach to automatic
differentiation is different from existing packages popular in machine
learning, such as TensorFlow and Autograd. Advantages are that Tangent
generates gradient code in Python which is readable by the user, easy to
understand and debug, and has no runtime overhead. Tangent also introduces
abstractions for easily injecting logic into the generated gradient code,
further improving usability.
"
6217,"  Summarizes recent work on the wakefields and impedances of flat, metallic
plates with small corrugations
"
19000,"  As a living information and communications system, the genome encodes
patterns in single nucleotide polymorphisms (SNPs) reflecting human adaption
that optimizes population survival in differing environments. This paper
mathematically models environmentally induced adaptive forces that quantify
changes in the distribution of SNP frequencies between populations. We make
direct connections between biophysical methods (e.g. minimizing genomic free
energy) and concepts in population genetics. Our unbiased computer program
scanned a large set of SNPs in the major histocompatibility complex region, and
flagged an altitude dependency on a SNP associated with response to oxygen
deprivation. The statistical power of our double-blind approach is demonstrated
in the flagging of mathematical functional correlations of SNP
information-based potentials in multiple populations with specific
environmental parameters. Furthermore, our approach provides insights for new
discoveries on the biology of common variants. This paper demonstrates the
power of biophysical modeling of population diversity for better understanding
genome-environment interactions in biological phenomenon.
"
14338,"  In this paper, we present a number of robust methodologies for an underwater
robot to visually detect, follow, and interact with a diver for collaborative
task execution. We design and develop two autonomous diver-following
algorithms, the first of which utilizes both spatial- and frequency-domain
features pertaining to human swimming patterns in order to visually track a
diver. The second algorithm uses a convolutional neural network-based model for
robust tracking-by-detection. In addition, we propose a hand gesture-based
human-robot communication framework that is syntactically simpler and
computationally more efficient than the existing grammar-based frameworks. In
the proposed interaction framework, deep visual detectors are used to provide
accurate hand gesture recognition; subsequently, a finite-state machine
performs robust and efficient gesture-to-instruction mapping. The
distinguishing feature of this framework is that it can be easily adopted by
divers for communicating with underwater robots without using artificial
markers or requiring memorization of complex language rules. Furthermore, we
validate the performance and effectiveness of the proposed methodologies
through extensive field experiments in closed- and open-water environments.
Finally, we perform a user interaction study to demonstrate the usability
benefits of our proposed interaction framework compared to existing methods.
"
1894,"  This paper introduces the combinatorial Boolean model (CBM), which is defined
as the class of linear combinations of conjunctions of Boolean attributes. This
paper addresses the issue of learning CBM from labeled data. CBM is of high
knowledge interpretability but naïve learning of it requires exponentially
large computation time with respect to data dimension and sample size. To
overcome this computational difficulty, we propose an algorithm GRAB (GRAfting
for Boolean datasets), which efficiently learns CBM within the
$L_1$-regularized loss minimization framework. The key idea of GRAB is to
reduce the loss minimization problem to the weighted frequent itemset mining,
in which frequent patterns are efficiently computable. We employ benchmark
datasets to empirically demonstrate that GRAB is effective in terms of
computational efficiency, prediction accuracy and knowledge discovery.
"
6574,"  We study the estimation of the covariance matrix $\Sigma$ of a
$p$-dimensional normal random vector based on $n$ independent observations
corrupted by additive noise. Only a general nonparametric assumption is imposed
on the distribution of the noise without any sparsity constraint on its
covariance matrix. In this high-dimensional semiparametric deconvolution
problem, we propose spectral thresholding estimators that are adaptive to the
sparsity of $\Sigma$. We establish an oracle inequality for these estimators
under model miss-specification and derive non-asymptotic minimax convergence
rates that are shown to be logarithmic in $n/\log p$. We also discuss the
estimation of low-rank matrices based on indirect observations as well as the
generalization to elliptical distributions. The finite sample performance of
the threshold estimators is illustrated in a numerical example.
"
20329,"  How do you learn to navigate an Unmanned Aerial Vehicle (UAV) and avoid
obstacles? One approach is to use a small dataset collected by human experts:
however, high capacity learning algorithms tend to overfit when trained with
little data. An alternative is to use simulation. But the gap between
simulation and real world remains large especially for perception problems. The
reason most research avoids using large-scale real data is the fear of crashes!
In this paper, we propose to bite the bullet and collect a dataset of crashes
itself! We build a drone whose sole purpose is to crash into objects: it
samples naive trajectories and crashes into random objects. We crash our drone
11,500 times to create one of the biggest UAV crash dataset. This dataset
captures the different ways in which a UAV can crash. We use all this negative
flying data in conjunction with positive data sampled from the same
trajectories to learn a simple yet powerful policy for UAV navigation. We show
that this simple self-supervised model is quite effective in navigating the UAV
even in extremely cluttered environments with dynamic obstacles including
humans. For supplementary video see: this https URL
"
1676,"  In a general linear model, this paper derives a necessary and sufficient
condition under which two general ridge estimators coincide with each other.
The condition is given as a structure of the dispersion matrix of the error
term. Since the class of estimators considered here contains linear unbiased
estimators such as the ordinary least squares estimator and the best linear
unbiased estimator, our result can be viewed as a generalization of the
well-known theorems on the equality between these two estimators, which have
been fully studied in the literature. Two related problems are also considered:
equality between two residual sums of squares, and classification of dispersion
matrices by a perturbation approach.
"
4839,"  We derive the second order rates of joint source-channel coding, whose source
obeys an irreducible and ergodic Markov process when the channel is a discrete
memoryless, while a previous study solved it only in a special case. We also
compare the joint source-channel scheme with the separation scheme in the
second order regime while a previous study made a notable comparison only with
numerical calculation. To make these two notable progress, we introduce two
kinds of new distribution families, switched Gaussian convolution distribution
and *-product distribution, which are defined by modifying the Gaussian
distribution.
"
17941,"  In this paper we consider the Dvali and Gómez assumption that the end state
of a gravitational collapse is a Bose-Einstein condensate of gravitons. We then
construct the two Gross-Pitaevskii equations for a static and spherically
symmetric configuration of the condensate. These two equations correspond to
the constrained minimisation of the gravitational Hamiltonian with respect to
the redshift and the Newtonian potential, per given number of gravitons. We
find that the effective geometry of the condensate is the one of a gravastar (a
DeSitter star) with a sub-Planckian cosmological constant, for masses larger
than the Planck scale. Thus, a condensate corresponding to a semiclassical
black hole, is always quantum and weakly coupled. Finally, we obtain that the
boundary of our gravastar, although it is not the location of a horizon,
corresponds to the Schwarzschild radius.
"
15953,"  Generative modeling of high dimensional data like images is a notoriously
difficult and ill-defined problem. In particular, how to evaluate a learned
generative model is unclear. In this position paper, we argue that adversarial
learning, pioneered with generative adversarial networks (GANs), provides an
interesting framework to implicitly define more meaningful task losses for
generative modeling tasks, such as for generating ""visually realistic"" images.
We refer to those task losses as parametric adversarial divergences and we give
two main reasons why we think parametric divergences are good learning
objectives for generative modeling. Additionally, we unify the processes of
choosing a good structured loss (in structured prediction) and choosing a
discriminator architecture (in generative modeling) using statistical decision
theory; we are then able to formalize and quantify the intuition that ""weaker""
losses are easier to learn from, in a specific setting. Finally, we propose two
new challenging tasks to evaluate parametric and nonparametric divergences: a
qualitative task of generating very high-resolution digits, and a quantitative
task of learning data that satisfies high-level algebraic constraints. We use
two common divergences to train a generator and show that the parametric
divergence outperforms the nonparametric divergence on both the qualitative and
the quantitative task.
"
13436,"  We propose a novel approach to parameter estimation for simulator-based
statistical models with intractable likelihood. Our proposed method involves
recursive application of kernel ABC and kernel herding to the same observed
data. We provide a theoretical explanation regarding why the approach works,
showing (for the population setting) that, under a certain assumption, point
estimates obtained with this method converge to the true parameter, as
recursion proceeds. We have conducted a variety of numerical experiments,
including parameter estimation for a real-world pedestrian flow simulator, and
show that in most cases our method outperforms existing approaches.
"
11488,"  Technological developments call for increasing perception and action
capabilities of robots. Among other skills, vision systems that can adapt to
any possible change in the working conditions are needed. Since these
conditions are unpredictable, we need benchmarks which allow to assess the
generalization and robustness capabilities of our visual recognition
algorithms. In this work we focus on robotic kitting in unconstrained
scenarios. As a first contribution, we present a new visual dataset for the
kitting task. Differently from standard object recognition datasets, we provide
images of the same objects acquired under various conditions where camera,
illumination and background are changed. This novel dataset allows for testing
the robustness of robot visual recognition algorithms to a series of different
domain shifts both in isolation and unified. Our second contribution is a novel
online adaptation algorithm for deep models, based on batch-normalization
layers, which allows to continuously adapt a model to the current working
conditions. Differently from standard domain adaptation algorithms, it does not
require any image from the target domain at training time. We benchmark the
performance of the algorithm on the proposed dataset, showing its capability to
fill the gap between the performances of a standard architecture and its
counterpart adapted offline to the given target domain.
"
10969,"  This article develops a framework for testing general hypothesis in
high-dimensional models where the number of variables may far exceed the number
of observations. Existing literature has considered less than a handful of
hypotheses, such as testing individual coordinates of the model parameter.
However, the problem of testing general and complex hypotheses remains widely
open. We propose a new inference method developed around the hypothesis
adaptive projection pursuit framework, which solves the testing problems in the
most general case. The proposed inference is centered around a new class of
estimators defined as $l_1$ projection of the initial guess of the unknown onto
the space defined by the null. This projection automatically takes into account
the structure of the null hypothesis and allows us to study formal inference
for a number of long-standing problems. For example, we can directly conduct
inference on the sparsity level of the model parameters and the minimum signal
strength. This is especially significant given the fact that the former is a
fundamental condition underlying most of the theoretical development in
high-dimensional statistics, while the latter is a key condition used to
establish variable selection properties. Moreover, the proposed method is
asymptotically exact and has satisfactory power properties for testing very
general functionals of the high-dimensional parameters. The simulation studies
lend further support to our theoretical claims and additionally show excellent
finite-sample size and power properties of the proposed test.
"
4054,"  Deep neural networks (DNN) excel at extracting patterns. Through
representation learning and automated feature engineering on large datasets,
such models have been highly successful in computer vision and natural language
applications. Designing optimal network architectures from a principled or
rational approach however has been less than successful, with the best
successful approaches utilizing an additional machine learning algorithm to
tune the network hyperparameters. However, in many technical fields, there
exist established domain knowledge and understanding about the subject matter.
In this work, we develop a novel furcated neural network architecture that
utilizes domain knowledge as high-level design principles of the network. We
demonstrate proof-of-concept by developing IL-Net, a furcated network for
predicting the properties of ionic liquids, which is a class of complex
multi-chemicals entities. Compared to existing state-of-the-art approaches, we
show that furcated networks can improve model accuracy by approximately 20-35%,
without using additional labeled data. Lastly, we distill two key design
principles for furcated networks that can be adapted to other domains.
"
1715,"  Let $\Omega$ be an unbounded domain in $\mathbb{R}\times\mathbb{R}^{d}.$ A
positive harmonic function $u$ on $\Omega$ that vanishes on the boundary of
$\Omega$ is called a Martin function. In this note, we show that, when $\Omega$
is convex, the superlevel sets of a Martin function are also convex. As a
consequence we obtain that if in addition $\Omega$ is symmetric, then the
maximum of any Martin function along a slice $\Omega\cap
(\{t\}\times\mathbb{R}^d)$ is attained at $(t,0).$
"
2499,"  This Perspective provides examples of current and future applications of deep
learning in pharmacogenomics, including: (1) identification of novel regulatory
variants located in noncoding domains and their function as applied to
pharmacoepigenomics; (2) patient stratification from medical records; and (3)
prediction of drugs, targets, and their interactions. Deep learning
encapsulates a family of machine learning algorithms that over the last decade
has transformed many important subfields of artificial intelligence (AI) and
has demonstrated breakthrough performance improvements on a wide range of tasks
in biomedicine. We anticipate that in the future deep learning will be widely
used to predict personalized drug response and optimize medication selection
and dosing, using knowledge extracted from large and complex molecular,
epidemiological, clinical, and demographic datasets.
"
15796,"  User-based Collaborative Filtering (CF) is one of the most popular approaches
to create recommender systems. This approach is based on finding the most
relevant k users from whose rating history we can extract items to recommend.
CF, however, suffers from data sparsity and the cold-start problem since users
often rate only a small fraction of available items. One solution is to
incorporate additional information into the recommendation process such as
explicit trust scores that are assigned by users to others or implicit trust
relationships that result from social connections between users. Such
relationships typically form a very sparse trust network, which can be utilized
to generate recommendations for users based on people they trust. In our work,
we explore the use of a measure from network science, i.e. regular equivalence,
applied to a trust network to generate a similarity matrix that is used to
select the k-nearest neighbors for recommending items. We evaluate our approach
on Epinions and we find that we can outperform related methods for tackling
cold-start users in terms of recommendation accuracy.
"
9008,"  The ANAIS experiment aims at the confirmation of the DAMA/LIBRA signal at the
Canfranc Underground Laboratory (LSC). Several 12.5 kg NaI(Tl) modules produced
by Alpha Spectra Inc. have been operated there during the last years in various
set-ups; an outstanding light collection at the level of 15 photoelectrons per
keV, which allows triggering at 1 keV of visible energy, has been measured for
all of them and a complete characterization of their background has been
achieved. In the first months of 2017, the full ANAIS-112 set-up consisting of
nine Alpha Spectra detectors with a total mass of 112.5 kg was commissioned at
LSC and the first dark matter run started in August, 2017. Here, the latest
results on the detectors performance and measured background from the
commissioning run will be presented and the sensitivity prospects of the
ANAIS-112 experiment will be discussed.
"
11438,"  We investigate the dynamics of a coupled waveguide system with competing
linear and nonlinear loss-gain profiles which can facilitate power saturation.
We show the usefulness of the model in achieving unidirectional beam
propagation. In this regard, the considered type of coupled waveguide system
has two drawbacks, (i) difficulty in achieving perfect isolation of light in a
waveguide and (ii) existence of blow-up type behavior for certain input power
situations. We here show a nonlinear $\cal{PT}$ symmetric coupling that helps
to overcome these two drawbacks. Such a nonlinear coupling has close connection
with the phenomenon of stimulated Raman scattering. In particular, we have
elucidated the role of this nonlinear coupling using an integrable $\cal{PT}$
symmetric situation. In particular, using the integrals of motion, we have
reduced this coupled waveguide problem to the problem of dynamics of a particle
in a potential. With the latter picture, we have clearly illustrated the role
of the considered nonlinear coupling. The above $\cal{PT}$ symmetric case
corresponds to a limiting form of a general equation describing the phenomenon
of stimulated Raman scattering. We also point out the ability to transport
light unidirectionally even in this general case.
"
11620,"  This paper introduces a new free library for the Python programming language,
which provides a collection of structured linear transforms, that are not
represented as explicit two dimensional arrays but in a more efficient way by
exploiting the structural knowledge.
This allows fast and memory savy forward and backward transformations while
also provding a clean but still flexible interface to these effcient
algorithms, thus making code more readable, scable and adaptable.
We first outline the goals of this library, then how they were achieved and
lastly we demonstrate the performance compared to current state of the art
packages available for Python.
This library is released and distributed under a free license.
"
3429,"  A new majority and minority voted redundancy (MMR) scheme is proposed that
can provide the same degree of fault tolerance as N-modular redundancy (NMR)
but with fewer function units and a less sophisticated voting logic. Example
NMR and MMR circuits were implemented using a 32/28nm CMOS process and
compared. The results show that MMR circuits dissipate less power, occupy less
area, and encounter less critical path delay than the corresponding NMR
circuits while providing the same degree of fault tolerance. Hence the MMR is a
promising alternative to the NMR to efficiently implement high levels of
redundancy in safety-critical applications.
"
13086,"  Backscatter of electrons from a beta spectrometer, with incomplete energy
deposition, can lead to undesirable effects in many types of experiments. We
present and discuss the design and operation of a backscatter-suppressed beta
spectrometer that was developed as part of a program to measure the
electron-antineutrino correlation coefficient in neutron beta decay (aCORN). An
array of backscatter veto detectors surrounds a plastic scintillator beta
energy detector. The spectrometer contains an axial magnetic field gradient, so
electrons are efficiently admitted but have a low probability for escaping back
through the entrance after backscattering. The design, construction,
calibration, and performance of the spectrometer are discussed.
"
