id,abstract
11436,"  We introduce and describe the results of a novel shared task on bandit
learning for machine translation. The task was organized jointly by Amazon and
Heidelberg University for the first time at the Second Conference on Machine
Translation (WMT 2017). The goal of the task is to encourage research on
learning machine translation from weak user feedback instead of human
references or post-edits. On each of a sequence of rounds, a machine
translation system is required to propose a translation for an input, and
receives a real-valued estimate of the quality of the proposed translation for
learning. This paper describes the shared task's learning and evaluation setup,
using services hosted on Amazon Web Services (AWS), the data and evaluation
metrics, and the results of various machine translation architectures and
learning protocols.
"
15492,"  The 7th Symposium on Educational Advances in Artificial Intelligence
(EAAI'17, co-chaired by Sven Koenig and Eric Eaton) launched the EAAI New and
Future AI Educator Program to support the training of early-career university
faculty, secondary school faculty, and future educators (PhD candidates or
postdocs who intend a career in academia). As part of the program, awardees
were asked to address one of the following ""blue sky"" questions:
* How could/should Artificial Intelligence (AI) courses incorporate ethics
into the curriculum?
* How could we teach AI topics at an early undergraduate or a secondary
school level?
* AI has the potential for broad impact to numerous disciplines. How could we
make AI education more interdisciplinary, specifically to benefit
non-engineering fields?
This paper is a collection of their responses, intended to help motivate
discussion around these issues in AI education.
"
9957,"  Fractons are emergent particles which are immobile in isolation, but which
can move together in dipolar pairs or other small clusters. These exotic
excitations naturally occur in certain quantum phases of matter described by
tensor gauge theories. Previous research has focused on the properties of small
numbers of fractons and their interactions, effectively mapping out the
""Standard Model"" of fractons. In the present work, however, we consider systems
with a finite density of either fractons or their dipolar bound states, with a
focus on the $U(1)$ fracton models. We study some of the phases in which
emergent fractonic matter can exist, thereby initiating the study of the
""condensed matter"" of fractons. We begin by considering a system with a finite
density of fractons, which we show can exhibit microemulsion physics, in which
fractons form small-scale clusters emulsed in a phase dominated by long-range
repulsion. We then move on to study systems with a finite density of mobile
dipoles, which have phases analogous to many conventional condensed matter
phases. We focus on two major examples: Fermi liquids and quantum Hall phases.
A finite density of fermionic dipoles will form a Fermi surface and enter a
Fermi liquid phase. Interestingly, this dipolar Fermi liquid exhibits a
finite-temperature phase transition, corresponding to an unbinding transition
of fractons. Finally, we study chiral two-dimensional phases corresponding to
dipoles in ""quantum Hall"" states of their emergent magnetic field. We study
numerous aspects of these generalized quantum Hall systems, such as their edge
theories and ground state degeneracies.
"
18037,"  We investigate the terminal-pairibility problem in the case when the base
graph is a complete bipartite graph, and the demand graph is also bipartite
with the same color classes. We improve the lower bound on maximum value of
$\Delta(D)$ which still guarantees that the demand graph $D$ is
terminal-pairable in this setting. We also prove a sharp theorem on the maximum
number of edges such a demand graph can have.
"
1216,"  Publishing reproducible analyses is a long-standing and widespread challenge
for the scientific community, funding bodies and publishers. Although a
definitive solution is still elusive, the problem is recognized to affect all
disciplines and lead to a critical system inefficiency. Here, we propose a
blockchain-based approach to enhance scientific reproducibility, with a focus
on life science studies and precision medicine. While the interest of encoding
permanently into an immutable ledger all the study key information-including
endpoints, data and metadata, protocols, analytical methods and all
findings-has been already highlighted, here we apply the blockchain approach to
solve the issue of rewarding time and expertise of scientists that commit to
verify reproducibility. Our mechanism builds a trustless ecosystem of
researchers, funding bodies and publishers cooperating to guarantee digital and
permanent access to information and reproducible results. As a natural
byproduct, a procedure to quantify scientists' and institutions' reputation for
ranking purposes is obtained.
"
3692,"  The resonances associated with a fractional damped oscillator which is driven
by an oscillatory external force are studied. It is shown that such resonances
can be manipulated by tuning up either the coefficient of the fractional
damping or the order of the corresponding fractional derivatives.
"
6936,"  The moving sofa problem, posed by L. Moser in 1966, asks for the planar shape
of maximal area that can move around a right-angled corner in a hallway of unit
width. It is known that a maximal area shape exists, and that its area is at
least 2.2195... - the area of an explicit construction found by Gerver in 1992
- and at most $2\sqrt{2}=2.82...$, with the lower bound being conjectured as
the true value. We prove a new and improved upper bound of 2.37. The method
involves a computer-assisted proof scheme that can be used to rigorously derive
further improved upper bounds that converge to the correct value.
"
901,"  We have used soft x-ray photoemission electron microscopy to image the
magnetization of single domain La$_{0.7}$Sr$_{0.3}$MnO$_{3}$ nano-islands
arranged in geometrically frustrated configurations such as square ice and
kagome ice geometries. Upon thermal randomization, ensembles of nano-islands
with strong inter-island magnetic coupling relax towards low-energy
configurations. Statistical analysis shows that the likelihood of ensembles
falling into low-energy configurations depends strongly on the annealing
temperature. Annealing to just below the Curie temperature of the ferromagnetic
film (T$_{C}$ = 338 K) allows for a much greater probability of achieving low
energy configurations as compared to annealing above the Curie temperature. At
this thermally active temperature of 325 K, the ensemble of ferromagnetic
nano-islands explore their energy landscape over time and eventually transition
to lower energy states as compared to the frozen-in configurations obtained
upon cooling from above the Curie temperature. Thus, this materials system
allows for a facile method to systematically study thermal evolution of
artificial spin ice arrays of nano-islands at temperatures modestly above room
temperature.
"
14613,"  Kernel $k$-means clustering can correctly identify and extract a far more
varied collection of cluster structures than the linear $k$-means clustering
algorithm. However, kernel $k$-means clustering is computationally expensive
when the non-linear feature map is high-dimensional and there are many input
points. Kernel approximation, e.g., the Nyström method, has been applied in
previous works to approximately solve kernel learning problems when both of the
above conditions are present. This work analyzes the application of this
paradigm to kernel $k$-means clustering, and shows that applying the linear
$k$-means clustering algorithm to $\frac{k}{\epsilon} (1 + o(1))$ features
constructed using a so-called rank-restricted Nyström approximation results
in cluster assignments that satisfy a $1 + \epsilon$ approximation ratio in
terms of the kernel $k$-means cost function, relative to the guarantee provided
by the same algorithm without the use of the Nyström method. As part of the
analysis, this work establishes a novel $1 + \epsilon$ relative-error trace
norm guarantee for low-rank approximation using the rank-restricted Nyström
approximation. Empirical evaluations on the $8.1$ million instance MNIST8M
dataset demonstrate the scalability and usefulness of kernel $k$-means
clustering with Nyström approximation. This work argues that spectral
clustering using Nyström approximation---a popular and computationally
efficient, but theoretically unsound approach to non-linear clustering---should
be replaced with the efficient and theoretically sound combination of kernel
$k$-means clustering with Nyström approximation. The superior performance of
the latter approach is empirically verified.
"
18633,"  Halide perovskite (HaP) semiconductors are revolutionizing photovoltaic (PV)
solar energy conversion by showing remarkable performance of solar cells made
with esp. tetragonal methylammonium lead tri-iodide (MAPbI3). In particular,
the low voltage loss of these cells implies a remarkably low recombination rate
of photogenerated carriers. It was suggested that low recombination can be due
to spatial separation of electrons and holes, a possibility if MAPbI3 is a
semiconducting ferroelectric, which, however, requires clear experimental
evidence. As a first step we show that, in operando, MAPbI3 (unlike MAPbBr3) is
pyroelectric, which implies it can be ferroelectric. The next step, proving it
is (not) ferroelectric, is challenging, because of the material s relatively
high electrical conductance (a consequence of an optical band gap suitable for
PV conversion!) and low stability under high applied bias voltage. This
excludes normal measurements of a ferroelectric hysteresis loop to prove
ferroelctricity s hallmark for switchable polarization. By adopting an approach
suitable for electrically leaky materials as MAPbI3, we show here ferroelectric
hysteresis from well-characterized single crystals at low temperature (still
within the tetragonal phase, which is the room temperature stable phase). Using
chemical etching, we also image polar domains, the structural fingerprint for
ferroelectricity, periodically stacked along the polar axis of the crystal,
which, as predicted by theory, scale with the overall crystal size. We also
succeeded in detecting clear second-harmonic generation, direct evidence for
the material s non-centrosymmetry. We note that the material s ferroelectric
nature, can, but not obviously need to be important in a PV cell, operating
around room temperature.
"
14274,"  Henrik Bruus is professor of lab-chip systems and theoretical physics at the
Technical University of Denmark. In this contribution, he summarizes some of
the recent results within theory and simulation of microscale acoustofluidic
systems that he has obtained in collaboration with his students and
international colleagues. The main emphasis is on three dynamical effects
induced by external ultrasound fields acting on aqueous solutions and particle
suspensions: The acoustic radiation force acting on suspended micro- and
nanoparticles, the acoustic streaming appearing in the fluid, and the newly
discovered acoustic body force acting on inhomogeneous solutions.
"
20044,"  In this study, the gravitational octree code originally optimized for the
Fermi, Kepler, and Maxwell GPU architectures is adapted to the Volta
architecture. The Volta architecture introduces independent thread scheduling
requiring either the insertion of the explicit synchronizations at appropriate
locations or the enforcement of the same implicit synchronizations as do the
Pascal or earlier architectures by specifying \texttt{-gencode
arch=compute\_60,code=sm\_70}. The performance measurements on Tesla V100, the
current flagship GPU by NVIDIA, revealed that the $N$-body simulations of the
Andromeda galaxy model with $2^{23} = 8388608$ particles took $3.8 \times
10^{-2}$~s or $3.3 \times 10^{-2}$~s per step for each case. Tesla V100
achieves a 1.4 to 2.2-fold acceleration in comparison with Tesla P100, the
flagship GPU in the previous generation. The observed speed-up of 2.2 is
greater than 1.5, which is the ratio of the theoretical peak performance of the
two GPUs. The independence of the units for integer operations from those for
floating-point number operations enables the overlapped execution of integer
and floating-point number operations. It hides the execution time of the
integer operations leading to the speed-up rate above the theoretical peak
performance ratio. Tesla V100 can execute $N$-body simulation with up to $25
\times 2^{20} = 26214400$ particles, and it took $2.0 \times 10^{-1}$~s per
step. It corresponds to $3.5$~TFlop/s, which is 22\% of the single-precision
theoretical peak performance.
"
10252,"  Among recently introduced new notions in real algebraic geometry is that of
regulous functions. Such functions form a foundation for the development of
regulous geometry. Several interesting results on regulous varieties and
regulous sheaves are already available. In this paper, we define and
investigate regulous vector bundles. We establish algebraic and geometric
properties of such vector bundles, and identify them with stratified-algebraic
vector bundles. Furthermore, using new results on curve-rational functions, we
characterize regulous vector bundles among families of vector spaces
parametrized by an affine regulous variety. We also study relationships between
regulous and topological vector bundles.
"
5930,"  Using polarization-resolved transient reflection spectroscopy, we investigate
the ultrafast modulation of light interacting with a metasurface consisting of
coherently vibrating nanophotonic meta-atoms in the form of U-shaped split-ring
resonators, that exhibit co-localized optical and mechanical resonances. With a
two-dimensional square-lattice array of these resonators formed of gold on a
glass substrate, we monitor the visible-pump-pulse induced gigahertz
oscillations in intensity of reflected linearly-polarized infrared probe light
pulses, modulated by the resonators effectively acting as miniature tuning
forks. A multimodal vibrational response involving the opening and closing
motion of the split rings is detected in this way. Numerical simulations of the
associated transient deformations and strain fields elucidate the complex
nanomechanical dynamics contributing to the ultrafast optical modulation, and
point to the role of acousto-plasmonic interactions through the opening and
closing motion of the SRR gaps as the dominant effect. Applications include
ultrafast acoustooptic modulator design and sensing.
"
3481,"  We examine the growth and evolution of quenched galaxies in the Mufasa
cosmological hydrodynamic simulations that include an evolving halo mass-based
quenching prescription, with galaxy colours computed accounting for
line-of-sight extinction to individual star particles. Mufasa reproduces the
observed present-day red sequence reasonably well, including its slope,
amplitude, and scatter. In Mufasa, the red sequence slope is driven entirely by
the steep stellar mass-stellar metallicity relation, which independently agrees
with observations. High-mass star-forming galaxies blend smoothly onto the red
sequence, indicating the lack of a well-defined green valley at M*>10^10.5 Mo.
The most massive galaxies quench the earliest and then grow very little in mass
via dry merging; they attain their high masses at earlier epochs when cold
inflows more effectively penetrate hot halos. To higher redshifts, the red
sequence becomes increasingly contaminated with massive dusty star-forming
galaxies; UVJ selection subtly but effectively separates these populations. We
then examine the evolution of the mass functions of central and satellite
galaxies split into passive and star-forming via UVJ. Massive quenched systems
show good agreement with observations out to z~2, despite not including a rapid
early quenching mode associated with mergers. However, low-mass quenched
galaxies are far too numerous at z<1 in Mufasa, indicating that Mufasa strongly
over-quenches satellites. A challenge for hydrodynamic simulations is to devise
a quenching model that produces enough early massive quenched galaxies and
keeps them quenched to z=0, while not being so strong as to over-quench
satellites; Mufasa's current scheme fails at the latter.
"
7857,"  We consider the problem of provably optimal exploration in reinforcement
learning for finite horizon MDPs. We show that an optimistic modification to
value iteration achieves a regret bound of $\tilde{O}( \sqrt{HSAT} +
H^2S^2A+H\sqrt{T})$ where $H$ is the time horizon, $S$ the number of states,
$A$ the number of actions and $T$ the number of time-steps. This result
improves over the best previous known bound $\tilde{O}(HS \sqrt{AT})$ achieved
by the UCRL2 algorithm of Jaksch et al., 2010. The key significance of our new
results is that when $T\geq H^3S^3A$ and $SA\geq H$, it leads to a regret of
$\tilde{O}(\sqrt{HSAT})$ that matches the established lower bound of
$\Omega(\sqrt{HSAT})$ up to a logarithmic factor. Our analysis contains two key
insights. We use careful application of concentration inequalities to the
optimal value function as a whole, rather than to the transitions probabilities
(to improve scaling in $S$), and we define Bernstein-based ""exploration
bonuses"" that use the empirical variance of the estimated values at the next
states (to improve scaling in $H$).
"
5624,"  We establish effective mean-value estimates for a wide class of
multiplicative arithmetic functions, thereby providing (essentially optimal)
quantitative versions of Wirsing's classical estimates and extending those of
Halász. Several applications are derived, including: estimates for the
difference of mean-values of so-called pretentious functions, local laws for
the distribution of prime factors in an arbitrary set, and weighted
distribution of additive functions.
"
14919,"  In 1992 a puzzling transition was discovered in simulations of randomly
coupled limit-cycle oscillators. This so-called volcano transition has resisted
analysis ever since. It was originally conjectured to mark the emergence of an
oscillator glass, but here we show it need not. We introduce and solve a
simpler model with a qualitatively identical volcano transition and find,
unexpectedly, that its supercritical state is not glassy. We discuss the
implications for the original model and suggest experimental systems in which a
volcano transition and oscillator glass may appear.
"
1130,"  We propose a new localized inference algorithm for answering marginalization
queries in large graphical models with the correlation decay property. Given a
query variable and a large graphical model, we define a much smaller model in a
local region around the query variable in the target model so that the marginal
distribution of the query variable can be accurately approximated. We introduce
two approximation error bounds based on the Dobrushin's comparison theorem and
apply our bounds to derive a greedy expansion algorithm that efficiently guides
the selection of neighbor nodes for localized inference. We verify our
theoretical bounds on various datasets and demonstrate that our localized
inference algorithm can provide fast and accurate approximation for large
graphical models.
"
20391,"  We consider a two-node tandem queueing network in which the upstream queue is
M/G/1 and each job reuses its upstream service requirement when moving to the
downstream queue. Both servers employ the first-in-first-out policy. We
investigate the amount of work in the second queue at certain embedded arrival
time points, namely when the upstream queue has just emptied. We focus on the
case of infinite-variance service times and obtain a heavy traffic process
limit for the embedded Markov chain.
"
8853,"  Domain shift refers to the well known problem that a model trained in one
source domain performs poorly when applied to a target domain with different
statistics. {Domain Generalization} (DG) techniques attempt to alleviate this
issue by producing models which by design generalize well to novel testing
domains. We propose a novel {meta-learning} method for domain generalization.
Rather than designing a specific model that is robust to domain shift as in
most previous DG work, we propose a model agnostic training procedure for DG.
Our algorithm simulates train/test domain shift during training by synthesizing
virtual testing domains within each mini-batch. The meta-optimization objective
requires that steps to improve training domain performance should also improve
testing domain performance. This meta-learning procedure trains models with
good generalization ability to novel domains. We evaluate our method and
achieve state of the art results on a recent cross-domain image classification
benchmark, as well demonstrating its potential on two classic reinforcement
learning tasks.
"
16196,"  Alternating minimization, or Fienup methods, have a long history in phase
retrieval. We provide new insights related to the empirical and theoretical
analysis of these algorithms when used with Fourier measurements and combined
with convex priors. In particular, we show that Fienup methods can be viewed as
performing alternating minimization on a regularized nonconvex least-squares
problem with respect to amplitude measurements. We then prove that under mild
additional structural assumptions on the prior (semi-algebraicity), the
sequence of signal estimates has a smooth convergent behaviour towards a
critical point of the nonconvex regularized least-squares objective. Finally,
we propose an extension to Fienup techniques, based on a projected gradient
descent interpretation and acceleration using inertial terms. We demonstrate
experimentally that this modification combined with an $\ell_1$ prior
constitutes a competitive approach for sparse phase retrieval.
"
16099,"  We give an elementary proof for the fact that an irreducible hyperbolic
polynomial has only one pair of hyperbolicity cones.
"
14115,"  The declination is a quantitative method for identifying possible partisan
gerrymanders by analyzing vote distributions. In this expository note we
explain and motivate the definition of the declination. The minimal computer
code required for computing the declination is included. We end by computing
its value on several recent elections.
"
2589,"  The concept of a C-class of differential equations goes back to E. Cartan
with the upshot that generic equations in a C-class can be solved without
integration. While Cartan's definition was in terms of differential invariants
being first integrals, all results exhibiting C-classes that we are aware of
are based on the fact that a canonical Cartan geometry associated to the
equations in the class descends to the space of solutions. For sufficiently low
orders, these geometries belong to the class of parabolic geometries and the
results follow from the general characterization of geometries descending to a
twistor space.
In this article we answer the question of whether a canonical Cartan geometry
descends to the space of solutions in the case of scalar ODEs of order at least
four and of systems of ODEs of order at least three. As in the lower order
cases, this is characterized by the vanishing of the generalized Wilczynski
invariants, which are defined via the linearization at a solution. The
canonical Cartan geometries (which are not parabolic geometries) are a slight
variation of those available in the literature based on a recent general
construction. All the verifications needed to apply this construction for the
classes of ODEs we study are carried out in the article, which thus also
provides a complete alternative proof for the existence of canonical Cartan
connections associated to higher order (systems of) ODEs.
"
11313,"  We demonstrate the existence of the excited state of an exciton-polariton in
a semiconductor microcavity. The strong coupling of the quantum well heavy-hole
exciton in an excited 2s state to the cavity photon is observed in non-zero
magnetic field due to surprisingly fast increase of Rabi energy of the 2s
exciton-polariton in magnetic field. This effect is explained by a strong
modification of the wave-function of the relative electron-hole motion for the
2s exciton state.
"
13002,"  We show that in $\text{O}(D)$ invariant matrix theories containing a large
number $D$ of complex or Hermitian matrices, one can define a
$D\rightarrow\infty$ limit for which the sum over planar diagrams truncates to
a tractable, yet non-trivial, sum over melon diagrams. In particular, results
obtained recently in SYK and tensor models can be generalized to traditional,
string-inspired matrix quantum mechanical models of black holes.
"
