id,abstract
20149,"  Let $n$ and $k$ be natural numbers such that $2^k < n$. We study the
restriction to $\mathfrak{S}_{n-2^k}$ of odd-degree irreducible characters of
the symmetric group $\mathfrak{S}_n$. This analysis completes the study begun
in [Ayyer A., Prasad A., Spallone S., Sem. Lothar. Combin. 75 (2015), Art.
B75g, 13 pages] and recently developed in [Isaacs I.M., Navarro G., Olsson
J.B., Tiep P.H., J. Algebra 478 (2017), 271-282].
"
2099,"  Predicting Arctic sea ice extent is a notoriously difficult forecasting
problem, even for lead times as short as one month. Motivated by Arctic
intraannual variability phenomena such as reemergence of sea surface
temperature and sea ice anomalies, we use a prediction approach for sea ice
anomalies based on analog forecasting. Traditional analog forecasting relies on
identifying a single analog in a historical record, usually by minimizing
Euclidean distance, and forming a forecast from the analog's historical
trajectory. Here an ensemble of analogs are used to make forecasts, where the
ensemble weights are determined by a dynamics-adapted similarity kernel, which
takes into account the nonlinear geometry on the underlying data manifold. We
apply this method for forecasting pan-Arctic and regional sea ice area and
volume anomalies from multi-century climate model data, and in many cases find
improvement over the benchmark damped persistence forecast. Examples of success
include the 3--6 month lead time prediction of pan-Arctic area, the winter sea
ice area prediction of some marginal ice zone seas, and the 3--12 month lead
time prediction of sea ice volume anomalies in many central Arctic basins. We
discuss possible connections between KAF success and sea ice reemergence, and
find KAF to be successful in regions and seasons exhibiting high interannual
variability.
"
7811,"  Network coding based peer-to-peer streaming represents an effective solution
to aggregate user capacities and to increase system throughput in live
multimedia streaming. Nonetheless, such systems are vulnerable to pollution
attacks where a handful of malicious peers can disrupt the communication by
transmitting just a few bogus packets which are then recombined and relayed by
unaware honest nodes, further spreading the pollution over the network. Whereas
previous research focused on malicious nodes identification schemes and
pollution-resilient coding, in this paper we show pollution countermeasures
which make a standard network coding scheme resilient to pollution attacks.
Thanks to a simple yet effective analytical model of a reference node
collecting packets by malicious and honest neighbors, we demonstrate that i)
packets received earlier are less likely to be polluted and ii) short
generations increase the likelihood to recover a clean generation. Therefore,
we propose a recombination scheme where nodes draw packets to be recombined
according to their age in the input queue, paired with a decoding scheme able
to detect the reception of polluted packets early in the decoding process and
short generations. The effectiveness of our approach is experimentally
evaluated in a real system we developed and deployed on hundreds to thousands
peers. Experimental evidence shows that, thanks to our simple countermeasures,
the effect of a pollution attack is almost canceled and the video quality
experienced by the peers is comparable to pre-attack levels.
"
19856,"  The problem of the estimation of relevance to a set of histograms generated
by samples of a discrete time process is discussed on the base of the
variational principles proposed in the previous paper [1]. Some conditions for
dimension reduction of corresponding linear programming problems are presented
also.
"
13057,"  We study the problem of cooperative inference where a group of agents
interact over a network and seek to estimate a joint parameter that best
explains a set of observations. Agents do not know the network topology or the
observations of other agents. We explore a variational interpretation of the
Bayesian posterior density, and its relation to the stochastic mirror descent
algorithm, to propose a new distributed learning algorithm. We show that, under
appropriate assumptions, the beliefs generated by the proposed algorithm
concentrate around the true parameter exponentially fast. We provide explicit
non-asymptotic bounds for the convergence rate. Moreover, we develop explicit
and computationally efficient algorithms for observation models belonging to
exponential families.
"
13016,"  We present absolute frequency measurement of the unperturbed P7 P7 O$_2$
B-band transition with relative standard uncertainty of $2\times10^{-11}$. We
reached the level of accuracy typical for Doppler-free techniques, with
Doppler-limited spectroscopy. The Doppler-limited shapes of the P7 P7 spectral
line were measured with a frequency-stabilized cavity ring-down spectrometer
referenced to an $^{88}$Sr optical atomic clock by an optical frequency comb.
"
7232,"  Recently a certain $q$-Painlevé type system has been obtained from a
reduction of the $q$-Garnier system. In this paper it is shown that the
$q$-Painlevé type system is associated with another realization of the affine
Weyl group symmetry of type $E_7^{(1)}$ and is different from the well-known
$q$-Painlevé system of type $E_7^{(1)}$ from the point of view of evolution
directions. We also study a connection between the $q$-Painlevé type system
and the $q$-Painlevé system of type $E_7^{(1)}$. Furthermore determinant
formulas of particular solutions for the $q$-Painlevé type system are
constructed in terms of the terminating $q$-hypergeometric function.
"
18320,"  We show that any $d$-colored set of points in general position in
$\mathbb{R}^d$ can be partitioned into $n$ subsets with disjoint convex hulls
such that the set of points and all color classes are partitioned as evenly as
possible. This extends results by Holmsen, Kynčl & Valculescu (2017) and
establishes a special case of their general conjecture. Our proof utilizes a
result obtained independently by Soberón and by Karasev in 2010, on
simultaneous equipartitions of $d$ continuous measures in $\mathbb{R}^d$ by $n$
convex regions. This gives a convex partition of $\mathbb{R}^d$ with the
desired properties, except that points may lie on the boundaries of the
regions. In order to resolve the ambiguous assignment of these points, we set
up a network flow problem. The equipartition of the continuous measures gives a
fractional flow. The existence of an integer flow then yields the desired
partition of the point set.
"
16550,"  We prove an inverse theorem for the Gowers $U^2$-norm for maps $G\to\mathcal
M$ from an countable, discrete, amenable group $G$ into a von Neumann algebra
$\mathcal M$ equipped with an ultraweakly lower semi-continuous, unitarily
invariant (semi-)norm $\Vert\cdot\Vert$. We use this result to prove a
stability result for unitary-valued $\varepsilon$-representations $G\to\mathcal
U(\mathcal M)$ with respect to $\Vert\cdot \Vert$.
"
11117,"  The stochastic variance-reduced gradient method (SVRG) and its accelerated
variant (Katyusha) have attracted enormous attention in the machine learning
community in the last few years due to their superior theoretical properties
and empirical behaviour on training supervised machine learning models via the
empirical risk minimization paradigm. A key structural element in both of these
methods is the inclusion of an outer loop at the beginning of which a full pass
over the training data is made in order to compute the exact gradient, which is
then used to construct a variance-reduced estimator of the gradient. In this
work we design {\em loopless variants} of both of these methods. In particular,
we remove the outer loop and replace its function by a coin flip performed in
each iteration designed to trigger, with a small probability, the computation
of the gradient. We prove that the new methods enjoy the same superior
theoretical convergence properties as the original methods. However, we
demonstrate through numerical experiments that our methods have substantially
superior practical behavior.
"
12417,"  It is argued that many of the problems and ambiguities of standard cosmology
derive from a single one: violation of conservation of energy in the standard
paradigm. Standard cosmology satisfies conservation of local energy, however
disregards the inherent global aspect of energy. We therefore explore
conservation of the quasi-local Misner-Sharp energy within the causal horizon,
which, as we argue, is necessarily an apparent horizon. Misner-Sharp energy
assumes the presence of arbitrary mass-energy. Its conservation, however,
yields ""empty"" de Sitter (open, flat, closed) as single cosmological solution,
where Misner-Sharp total energy acts as cosmological constant and where the
source of curvature energy is unidentified. It is argued that de Sitter is only
apparently empty of matter. That is, total matter energy scales as curvature
energy in open de Sitter, which causes evolution of the cosmic potential and
induces gravitational time dilation. Curvature of time accounts completely for
the extrinsic curvature, i.e., renders open de Sitter spatially flat. This
explains the well known, surprising, spatial flatness of Misner-Sharp energy,
even if extrinsic curvature is non-zero. The general relativistic derivation
from Misner-Sharp energy is confirmed by a Machian equation of recessional and
peculiar energy, which explicitly assumes the presence of matter. This
relational model enhances interpretation. Time-dilated open de Sitter is
spatially flat, dynamically close to $\Lambda$CDM, and is shown to be without
the conceptual problems of concordance cosmology.
"
18845,"  Measuring domain relevance of data and identifying or selecting well-fit
domain data for machine translation (MT) is a well-studied topic, but denoising
is not yet. Denoising is concerned with a different type of data quality and
tries to reduce the negative impact of data noise on MT training, in
particular, neural MT (NMT) training. This paper generalizes methods for
measuring and selecting data for domain MT and applies them to denoising NMT
training. The proposed approach uses trusted data and a denoising curriculum
realized by online data selection. Intrinsic and extrinsic evaluations of the
approach show its significant effectiveness for NMT to train on data with
severe noise.
"
9883,"  We derive the Markov process equivalent to She-Leveque scaling in homogeneous
and isotropic turbulence. The Markov process is a jump process for velocity
increments $u(r)$ in scale $r$ in which the jumps occur randomly but with
deterministic width in $u$. From its master equation we establish a
prescription to simulate the She-Leveque process and compare it with Kolmogorov
scaling. To put the She-Leveque process into the context of other established
turbulence models on the Markov level, we derive a diffusion process for $u(r)$
from two properties of the Navier-Stokes equation. This diffusion process
already includes Kolmogorov scaling, extended self-similarity and a class of
random cascade models. The fluctuation theorem of this Markov process implies a
""second law"" that puts a loose bound on the multipliers of the random cascade
models. This bound explicitly allows for inverse cascades, which are necessary
to satisfy the fluctuation theorem. By adding a jump process to the diffusion
process, we go beyond Kolmogorov scaling and formulate the most general scaling
law for the class of Markov processes having both diffusion and jump parts.
This Markov scaling law includes She-Leveque scaling and a scaling law derived
by Yakhot.
"
10737,"  Formal verification techniques are widely used for detecting design flaws in
software systems. Formal verification can be done by transforming an already
implemented source code to a formal model and attempting to prove certain
properties of the model (e.g. that no erroneous state can occur during
execution). Unfortunately, transformations from source code to a formal model
often yield large and complex models, making the verification process
inefficient and costly. In order to reduce the size of the resulting model,
optimization transformations can be used. Such optimizations include common
algorithms known from compiler design and different program slicing techniques.
Our paper describes a framework for transforming C programs to a formal model,
enhanced by various optimizations for size reduction. We evaluate and compare
several optimization algorithms regarding their effect on the size of the model
and the efficiency of the verification. Results show that different
optimizations are more suitable for certain models, justifying the need for a
framework that includes several algorithms.
"
14217,"  For $d\geq1$, we study the simplicial structure of the chain complex
associated to the higher order Hochschild homology over the $d$-sphere. We
discuss $H_\bullet^{S^d}(A,M)$ by way of a bar-like resolution
$\mathcal{B}^d(A)$ in the context of simplicial modules. Besides the general
case, we give explicit detail corresponding to $S^3$. We also present a
description of what can replace these bar-like resolutions in order to aid with
computation. The cohomology version can be done following a similar
construction, of which we make mention.
"
2611,"  We propose new smoothed median and the Wilcoxon's rank sum test. As is
pointed out by Maesono et al.(2016), some nonparametric discrete tests have a
problem with their significance probability. Because of this problem, the
selection of the median and the Wilcoxon's test can be biased too, however, we
show new smoothed tests are free from the problem. Significance probabilities
and local asymptotic powers of the new tests are studied, and we show that they
inherit good properties of the discrete tests.
"
2257,"  Many applied settings in empirical economics involve simultaneous estimation
of a large number of parameters. In particular, applied economists are often
interested in estimating the effects of many-valued treatments (like teacher
effects or location effects), treatment effects for many groups, and prediction
models with many regressors. In these settings, machine learning methods that
combine regularized estimation and data-driven choices of regularization
parameters are useful to avoid over-fitting. In this article, we analyze the
performance of a class of machine learning estimators that includes ridge,
lasso and pretest in contexts that require simultaneous estimation of many
parameters. Our analysis aims to provide guidance to applied researchers on (i)
the choice between regularized estimators in practice and (ii) data-driven
selection of regularization parameters. To address (i), we characterize the
risk (mean squared error) of regularized estimators and derive their relative
performance as a function of simple features of the data generating process. To
address (ii), we show that data-driven choices of regularization parameters,
based on Stein's unbiased risk estimate or on cross-validation, yield
estimators with risk uniformly close to the risk attained under the optimal
(unfeasible) choice of regularization parameters. We use data from recent
examples in the empirical economics literature to illustrate the practical
applicability of our results.
"
10643,"  We introduce a new shape-constrained class of distribution functions on R,
the bi-$s^*$-concave class. In parallel to results of Dümbgen, Kolesnyk, and
Wilke (2017) for what they called the class of bi-log-concave distribution
functions, we show that every s-concave density f has a bi-$s^*$-concave
distribution function $F$ and that every bi-$s^*$-concave distribution function
satisfies $\gamma (F) \le 1/(1+s)$ where finiteness of $$ \gamma (F) \equiv
\sup_{x} F(x) (1-F(x)) \frac{| f' (x)|}{f^2 (x)}, $$ the Csörgő -
Révész constant of F, plays an important role in the theory of quantile
processes on $R$.
"
1045,"  We present the calibrated-projection MATLAB package implementing the method
to construct confidence intervals proposed by Kaido, Molinari and Stoye (2017).
This manual provides details on how to use the package for inference on
projections of partially identified parameters. It also explains how to use the
MATLAB functions we developed to compute confidence intervals on solutions of
nonlinear optimization problems with estimated constraints.
"
6149,"  We establish a new connection between value and policy based reinforcement
learning (RL) based on a relationship between softmax temporal value
consistency and policy optimality under entropy regularization. Specifically,
we show that softmax consistent action values correspond to optimal entropy
regularized policy probabilities along any action sequence, regardless of
provenance. From this observation, we develop a new RL algorithm, Path
Consistency Learning (PCL), that minimizes a notion of soft consistency error
along multi-step action sequences extracted from both on- and off-policy
traces. We examine the behavior of PCL in different scenarios and show that PCL
can be interpreted as generalizing both actor-critic and Q-learning algorithms.
We subsequently deepen the relationship by showing how a single model can be
used to represent both a policy and the corresponding softmax state values,
eliminating the need for a separate critic. The experimental evaluation
demonstrates that PCL significantly outperforms strong actor-critic and
Q-learning baselines across several benchmarks.
"
6917,"  In this paper, we derive a Bayesian model order selection rule by using the
exponentially embedded family method, termed Bayesian EEF. Unlike many other
Bayesian model selection methods, the Bayesian EEF can use vague proper priors
and improper noninformative priors to be objective in the elicitation of
parameter priors. Moreover, the penalty term of the rule is shown to be the sum
of half of the parameter dimension and the estimated mutual information between
parameter and observed data. This helps to reveal the EEF mechanism in
selecting model orders and may provide new insights into the open problems of
choosing an optimal penalty term for model order selection and choosing a good
prior from information theoretic viewpoints. The important example of linear
model order selection is given to illustrate the algorithms and arguments.
Lastly, the Bayesian EEF that uses Jeffreys prior coincides with the EEF rule
derived by frequentist strategies. This shows another interesting relationship
between the frequentist and Bayesian philosophies for model selection.
"
7712,"  We give a new bound on the number of collinear triples for two arbitrary
subsets of a finite field. This improves on existing results which rely on the
Cauchy inequality. We then us this to provide a new bound on trilinear and
quadrilinear exponential sums.
"
14847,"  We study radiative neutrino pair emission in deexcitation process of atoms
taking into account coherence effect in a macroscopic target system. In the
course of preparing the coherent initial state to enhance the rate, a spatial
phase factor is imprinted in the macroscopic target. It is shown that this
initial spatial phase changes the kinematics of the radiative neutrino pair
emission. We investigate effects of the initial spatial phase in the photon
spectrum of the process. It turns out that the initial spatial phase provides
us significant improvements in exploring neutrino physics such as the
Dirac-Majorana distinction and the cosmic neutrino background.
"
3362,"  We study the indices of the geodesic central configurations on $\H^2$. We
then show that central configurations are bounded away from the singularity
set. With Morse's inequality, we get a lower bound for the number of central
configurations on $\H^2$.
"
16928,"  The abundance of metals in galaxies is a key parameter which permits to
distinguish between different galaxy formation and evolution models. Most of
the metallicity determinations are based on optical line ratios. However, the
optical spectral range is subject to dust extinction and, for high-z objects (z
> 3), some of the lines used in optical metallicity diagnostics are shifted to
wavelengths not accessible to ground based observatories. For this reason, we
explore metallicity diagnostics using far-infrared (IR) line ratios which can
provide a suitable alternative in such situations. To investigate these far-IR
line ratios, we modeled the emission of a starburst with the photoionization
code CLOUDY. The most sensitive far-IR ratios to measure metallicities are the
[OIII]52$\mu$m and 88$\mu$m to [NIII]57$\mu$m ratios. We show that this ratio
produces robust metallicities in the presence of an AGN and is insensitive to
changes in the age of the ionizing stellar. Another metallicity sensitive ratio
is the [OIII]88$\mu$m/[NII]122$\mu$m ratio, although it depends on the
ionization parameter. We propose various mid- and far-IR line ratios to break
this dependency. Finally, we apply these far-IR diagnostics to a sample of 19
local ultraluminous IR galaxies (ULIRGs) observed with Herschel and Spitzer. We
find that the gas-phase metallicity in these local ULIRGs is in the range 0.7 <
Z_gas/Z_sun < 1.5, which corresponds to 8.5 < 12 + log (O/H) < 8.9. The
inferred metallicities agree well with previous estimates for local ULIRGs and
this confirms that they lie below the local mass-metallicity relation.
"
16261,"  Topological metrics of graphs provide a natural way to describe the prominent
features of various types of networks. Graph metrics describe the structure and
interplay of graph edges and have found applications in many scientific fields.
In this work, graph metrics are used in network estimation by developing
optimisation methods that incorporate prior knowledge of a network's topology.
The derivatives of graph metrics are used in gradient descent schemes for
weighted undirected network denoising, network completion, and network
decomposition. The successful performance of our methodology is shown in a
number of toy examples and real-world datasets. Most notably, our work
establishes a new link between graph theory, network science and optimisation.
"
16160,"  We classify certain subcategories in quotients of exact categories. In
particular, we classify the triangulated and thick subcategories of an
algebraic triangulated category, i.e. the stable category of a Frobenius
category.
"
6977,"  In this article we develop a new sequential Monte Carlo (SMC) method for
multilevel (ML) Monte Carlo estimation. In particular, the method can be used
to estimate expectations with respect to a target probability distribution over
an infinite-dimensional and non-compact space as given, for example, by a
Bayesian inverse problem with Gaussian random field prior. Under suitable
assumptions the MLSMC method has the optimal $O(\epsilon^{-2})$ bound on the
cost to obtain a mean-square error of $O(\epsilon^2)$. The algorithm is
accelerated by dimension-independent likelihood-informed (DILI) proposals
designed for Gaussian priors, leveraging a novel variation which uses empirical
sample covariance information in lieu of Hessian information, hence eliminating
the requirement for gradient evaluations. The efficiency of the algorithm is
illustrated on two examples: inversion of noisy pressure measurements in a PDE
model of Darcy flow to recover the posterior distribution of the permeability
field, and inversion of noisy measurements of the solution of an SDE to recover
the posterior path measure.
"
13197,"  The goal of the paper is to investigate the dynamics of the eigenvalues of
the Sturm-Liouville operator with summable PT-symmetric potential on the finite
interval. It turns out that the case of a complex Airy operator presents an
exactly solvable model which allows us to trace the dynamics of the movement of
the eigenvalues in all details and to find explicitly the critical parameter
values, in particular, to specify precisely the number $\varepsilon_1$ such
that for $0<\varepsilon<\varepsilon_1$ the operator has a real spectrum and is
similar to a self-adjoint operator.
"
14903,"  We propose a multi-layer approach to simulate hyperpycnal and hypopycnal
plumes in flows with free surface. The model allows to compute the vertical
profile of the horizontal and the vertical components of the velocity of the
fluid flow. The model can describe as well the vertical profile of the sediment
concentration and the velocity components of each one of the sediment species
that form the turbidity current. To do so, it takes into account the settling
velocity of the particles and their interaction with the fluid. This allows to
better describe the phenomena than a single layer approach. It is in better
agreement with the physics of the problem and gives promising results. The
numerical simulation is carried out by rewriting the multi-layer approach in a
compact formulation, which corresponds to a system with non-conservative
products, and using path-conservative numerical scheme. Numerical results are
presented in order to show the potential of the model.
"
14090,"  In this short paper we generalise a theorem due to Kani and Rosen on
decomposition of Jacobian varieties of Riemann surfaces with group action. This
generalisation extends the set of Jacobians for which it is possible to obtain
an isogeny decomposition where all the factors are Jacobians.
"
8768,"  We determine which of the modular curves $X_\Delta(N)$, that is, curves lying
between $X_0(N)$ and $X_1(N)$, are bielliptic. Somewhat surprisingly, we find
that one of these curves has exceptional automorphisms. Finally we find all
$X_\Delta(N)$ that have infinitely many quadratic points over $\mathbb{Q}$.
"
